{
  "schema_version": 1,
  "packet_id": "11111111-1111-4111-8111-111111111111",
  "packet_type": "hitl_request",
  "created_at": "2026-04-18T23:13:15Z",
  "issue_number": 296,
  "repo": {
    "owner": "NIBARGERB-HLDPRO",
    "name": "hldpro-governance"
  },
  "session": {
    "session_id": "codex-20260418-issue-296",
    "cli": "codex",
    "state": "waiting_hitl"
  },
  "correlation": {
    "request_id": "hitl-20260418-001"
  },
  "policy": {
    "pii_mode": "none",
    "data_classification": "internal",
    "channel_policy_ref": "docs/runbooks/hitl-relay-security.md"
  },
  "event_type": "hitl_checkpoint",
  "artifacts": [
    {
      "kind": "plan",
      "ref": "docs/plans/issue-296-structured-agent-cycle-plan.json"
    },
    {
      "kind": "execution_scope",
      "ref": "raw/execution-scopes/2026-04-18-issue-296-som-hitl-relay-planning.json"
    }
  ],
  "requested_decision": {
    "decision_type": "approval",
    "allowed_actions": [
      "approve",
      "request_changes",
      "pause",
      "details"
    ],
    "prompt_ref": "raw/hitl-requests/hitl-20260418-001.md"
  }
}
