{
  "schema_version": 1,
  "packet_id": "33333333-3333-4333-8333-333333333333",
  "packet_type": "session_resume",
  "created_at": "2026-04-18T23:15:15Z",
  "issue_number": 296,
  "repo": {
    "owner": "NIBARGERB-HLDPRO",
    "name": "hldpro-governance"
  },
  "session": {
    "session_id": "codex-20260418-issue-296",
    "cli": "codex",
    "state": "stale"
  },
  "correlation": {
    "request_id": "hitl-20260418-001",
    "parent_packet_id": "11111111-1111-4111-8111-111111111111",
    "notification_id": "ais-notify-20260418-001",
    "response_id": "ais-inbound-20260418-001"
  },
  "policy": {
    "pii_mode": "none",
    "data_classification": "internal",
    "channel_policy_ref": "docs/runbooks/hitl-relay-security.md"
  },
  "resume": {
    "reason": "session_stale",
    "resume_context_refs": [
      "raw/hitl-requests/hitl-20260418-001.json",
      "raw/hitl-responses/ais-inbound-20260418-001.json",
      "raw/closeouts/2026-04-18-hitl-checkpoint.md"
    ]
  }
}
